[
  {
    "entity_type": "project",
    "geo": "AR-C",
    "metric": "production_expected",
    "project_id": "mock-proj-0",
    "resource": "oil",
    "retrieved_at": "2026-10-02",
    "scenario": "base",
    "source": "MOCK",
    "unit": "t_per_year",
    "value": 3333.333333333333,
    "year": 2034
  },
  {
    "entity_type": "project",
    "geo": "AR-C",
    "metric": "production_expected",
    "project_id": "mock-proj-0",
    "resource": "oil",
    "retrieved_at": "2026-10-02",
    "scenario": "base",
    "source": "MOCK",
    "unit": "t_per_year",
    "value": 6666.666666666666,
    "year": 2035
  },
  {
    "entity_type": "project",
    "geo": "AR-C",
    "metric": "production_expected",
    "project_id": "mock-proj-0",
    "resource": "oil",
    "retrieved_at": "2026-10-02",
    "scenario": "base",
    "source": "MOCK",
    "unit": "t_per_year",
    "value": 10000.0,
    "year": 2036
  },
  {
    "entity_type": "project",
    "geo": "AR-C",
    "metric": "production_expected",
    "project_id": "mock-proj-0",
    "resource": "oil",
    "retrieved_at": "2026-10-02",
    "scenario": "base",
    "source": "MOCK",
    "unit": "t_per_year",
    "value": 10000.0,
    "year": 2037
  },
  {
    "entity_type": "project",
    "geo": "AR-C",
    "metric": "production_expected",
    "project_id": "mock-proj-0",
    "resource": "oil",
    "retrieved_at": "2026-10-02",
    "scenario": "base",
    "source": "MOCK",
    "unit": "t_per_year",
    "value": 10000.0,
    "year": 2038
  },
  {
    "entity_type": "project",
    "geo": "AR-C",
    "metric": "production_expected",
    "project_id": "mock-proj-0",
    "resource": "oil",
    "retrieved_at": "2026-10-02",
    "scenario": "base",
    "source": "MOCK",
    "unit": "t_per_year",
    "value": 10000.0,
    "year": 2039
  },
  {
    "entity_type": "project",
    "geo": "AR-C",
    "metric": "production_expected",
    "project_id": "mock-proj-0",
    "resource": "oil",
    "retrieved_at": "2026-10-02",
    "scenario": "base",
    "source": "MOCK",
    "unit": "t_per_year",
    "value": 10000.0,
    "year": 2040
  },
  {
    "entity_type": "project",
    "geo": "AR-C",
    "metric": "capacity_nameplate",
    "project_id": "mock-proj-0",
    "resource": "oil",
    "retrieved_at": "2026-10-02",
    "scenario": "base",
    "source": "MOCK",
    "unit": "t_per_year",
    "value": 10000,
    "year": 2037
  },
  {
    "entity_type": "project",
    "geo": "AR-B",
    "metric": "production_expected",
    "project_id": "mock-proj-1",
    "resource": "copper",
    "retrieved_at": "2026-10-02",
    "scenario": "base",
    "source": "MOCK",
    "unit": "t_per_year",
    "unit_basis": "contained_cu",
    "value": 3333.333333333333,
    "year": 2021
  },
  {
    "entity_type": "project",
    "geo": "AR-B",
    "metric": "production_expected",
    "project_id": "mock-proj-1",
    "resource": "copper",
    "retrieved_at": "2026-10-02",
    "scenario": "base",
    "source": "MOCK",
    "unit": "t_per_year",
    "unit_basis": "contained_cu",
    "value": 6666.666666666666,
    "year": 2022
  },
  {
    "entity_type": "project",
    "geo": "AR-B",
    "metric": "production_expected",
    "project_id": "mock-proj-1",
    "resource": "copper",
    "retrieved_at": "2026-10-02",
    "scenario": "base",
    "source": "MOCK",
    "unit": "t_per_year",
    "unit_basis": "contained_cu",
    "value": 10000.0,
    "year": 2023
  },
  {
    "entity_type": "project",
    "geo": "AR-B",
    "metric": "production_expected",
    "project_id": "mock-proj-1",
    "resource": "copper",
    "retrieved_at": "2026-10-02",
    "scenario": "base",
    "source": "MOCK",
    "unit": "t_per_year",
    "unit_basis": "contained_cu",
    "value": 10000.0,
    "year": 2024
  },
  {
    "entity_type": "project",
    "geo": "AR-B",
    "metric": "production_expected",
    "project_id": "mock-proj-1",
    "resource": "copper",
    "retrieved_at": "2026-10-02",
    "scenario": "base",
    "source": "MOCK",
    "unit": "t_per_year",
    "unit_basis": "contained_cu",
    "value": 10000.0,
    "year": 2025
  },
  {
    "entity_type": "project",
    "geo": "AR-B",
    "metric": "production_expected",
    "project_id": "mock-proj-1",
    "resource": "copper",
    "retrieved_at": "2026-10-02",
    "scenario": "base",
    "source": "MOCK",
    "unit": "t_per_year",
    "unit_basis": "contained_cu",
    "value": 10000.0,
    "year": 2026
  },
  {
    "entity_type": "project",
    "geo": "AR-B",
    "metric": "production_expected",
    "project_id": "mock-proj-1",
    "resource": "copper",
    "retrieved_at": "2026-10-02",
    "scenario": "base",
    "source": "MOCK",
    "unit": "t_per_year",
    "unit_basis": "contained_cu",
    "value": 10000.0,
    "year": 2027
  },
  {
    "entity_type": "project",
    "geo": "AR-B",
    "metric": "production_expected",
    "project_id": "mock-proj-1",
    "resource": "copper",
    "retrieved_at": "2026-10-02",
    "scenario": "base",
    "source": "MOCK",
    "unit": "t_per_year",
    "unit_basis": "contained_cu",
    "value": 10000.0,
    "year": 2028
  },
  {
    "entity_type": "project",
    "geo": "AR-B",
    "metric": "production_expected",
    "project_id": "mock-proj-1",
    "resource": "copper",
    "retrieved_at": "2026-10-02",
    "scenario": "base",
    "source": "MOCK",
    "unit": "t_per_year",
    "unit_basis": "contained_cu",
    "value": 10000.0,
    "year": 2029
  },
  {
    "entity_type": "project",
    "geo": "AR-B",
    "metric": "production_expected",
    "project_id": "mock-proj-1",
    "resource": "copper",
    "retrieved_at": "2026-10-02",
    "scenario": "base",
    "source": "MOCK",
    "unit": "t_per_year",
    "unit_basis": "contained_cu",
    "value": 10000.0,
    "year": 2030
  },
  {
    "entity_type": "project",
    "geo": "AR-B",
    "metric": "production_expected",
    "project_id": "mock-proj-1",
    "resource": "copper",
    "retrieved_at": "2026-10-02",
    "scenario": "base",
    "source": "MOCK",
    "unit": "t_per_year",
    "unit_basis": "contained_cu",
    "value": 10000.0,
    "year": 2031
  },
  {
    "entity_type": "project",
    "geo": "AR-B",
    "metric": "production_expected",
    "project_id": "mock-proj-1",
    "resource": "copper",
    "retrieved_at": "2026-10-02",
    "scenario": "base",
    "source": "MOCK",
    "unit": "t_per_year",
    "unit_basis": "contained_cu",
    "value": 10000.0,
    "year": 2032
  },
  {
    "entity_type": "project",
    "geo": "AR-B",
    "metric": "production_expected",
    "project_id": "mock-proj-1",
    "resource": "copper",
    "retrieved_at": "2026-10-02",
    "scenario": "base",
    "source": "MOCK",
    "unit": "t_per_year",
    "unit_basis": "contained_cu",
    "value": 10000.0,
    "year": 2033
  },
  {
    "entity_type": "project",
    "geo": "AR-B",
    "metric": "production_expected",
    "project_id": "mock-proj-1",
    "resource": "copper",
    "retrieved_at": "2026-10-02",
    "scenario": "base",
    "source": "MOCK",
    "unit": "t_per_year",
    "unit_basis": "contained_cu",
    "value": 10000.0,
    "year": 2034
  },
  {
    "entity_type": "project",
    "geo": "AR-B",
    "metric": "production_expected",
    "project_id": "mock-proj-1",
    "resource": "copper",
    "retrieved_at": "2026-10-02",
    "scenario": "base",
    "source": "MOCK",
    "unit": "t_per_year",
    "unit_basis": "contained_cu",
    "value": 10000.0,
    "year": 2035
  },
  {
    "entity_type": "project",
    "geo": "AR-B",
    "metric": "capacity_nameplate",
    "project_id": "mock-proj-1",
    "resource": "copper",
    "retrieved_at": "2026-10-02",
    "scenario": "base",
    "source": "MOCK",
    "unit": "t_per_year",
    "unit_basis": "contained_cu",
    "value": 10000,
    "year": 2024
  },
  {
    "entity_type": "project",
    "geo": "AR-M",
    "metric": "production_expected",
    "project_id": "mock-proj-2",
    "resource": "gas",
    "retrieved_at": "2026-10-02",
    "scenario": "base",
    "source": "MOCK",
    "unit": "t_per_year",
    "value": 12998.406666666666,
    "year": 2020
  },
  {
    "entity_type": "project",
    "geo": "AR-M",
    "metric": "production_expected",
    "project_id": "mock-proj-2",
    "resource": "gas",
    "retrieved_at": "2026-10-02",
    "scenario": "base",
    "source": "MOCK",
    "unit": "t_per_year",
    "value": 25996.81333333333,
    "year": 2021
  },
  {
    "entity_type": "project",
    "geo": "AR-M",
    "metric": "production_expected",
    "project_id": "mock-proj-2",
    "resource": "gas",
    "retrieved_at": "2026-10-02",
    "scenario": "base",
    "source": "MOCK",
    "unit": "t_per_year",
    "value": 38995.22,
    "year": 2022
  },
  {
    "entity_type": "project",
    "geo": "AR-M",
    "metric": "production_expected",
    "project_id": "mock-proj-2",
    "resource": "gas",
    "retrieved_at": "2026-10-02",
    "scenario": "base",
    "source": "MOCK",
    "unit": "t_per_year",
    "value": 38995.22,
    "year": 2023
  },
  {
    "entity_type": "project",
    "geo": "AR-M",
    "metric": "production_expected",
    "project_id": "mock-proj-2",
    "resource": "gas",
    "retrieved_at": "2026-10-02",
    "scenario": "base",
    "source": "MOCK",
    "unit": "t_per_year",
    "value": 38995.22,
    "year": 2024
  },
  {
    "entity_type": "project",
    "geo": "AR-M",
    "metric": "production_expected",
    "project_id": "mock-proj-2",
    "resource": "gas",
    "retrieved_at": "2026-10-02",
    "scenario": "base",
    "source": "MOCK",
    "unit": "t_per_year",
    "value": 38995.22,
    "year": 2025
  },
  {
    "entity_type": "project",
    "geo": "AR-M",
    "metric": "production_expected",
    "project_id": "mock-proj-2",
    "resource": "gas",
    "retrieved_at": "2026-10-02",
    "scenario": "base",
    "source": "MOCK",
    "unit": "t_per_year",
    "value": 38995.22,
    "year": 2026
  },
  {
    "entity_type": "project",
    "geo": "AR-M",
    "metric": "production_expected",
    "project_id": "mock-proj-2",
    "resource": "gas",